BOAMP_AVIS_NUM,D_14_01_Conditionparticipationsystmequalif_Conditions,D_14_02_Conditionparticipationsystmequalif_Methodeverification
18-159804,Consulter le règlement de consultation sur https://marches.e-bourgogne.fr/ Référence 2018-AAT3,Consulter le règlement de consultation sur https://marches.e-bourgogne.fr/ Référence 2018-AAT3
18-161444,Autorisation de fournir des denrées alimentaires à une restauration scolaire.,Présentation de justificatifs.
18-165224,voir le cahier des charges,
18-165660,se référer au Règlement de Consultation,
18-166776,Cf. règlement de la consultation,
