BOAMP_AVIS_NUM,D_10_01_Annulation_Annulinfoannonceanterieur,D_10_01_01_Annulation_Annulinfoannonceanterieur_Reference,D_10_01_01_01_Annulation_Annulinfoannonceanterieur_Reference_Idweb,D_10_01_01_02_Annulation_Annulinfoannonceanterieur_Reference_Typeavis,D_10_01_01_02_01_Annulation_Annulinfoannonceanterieur_Reference_Typeavis_Famille,D_10_01_01_02_01_01_Annulation_Annulinfoannonceanterieur_Reference_Typeavis_Famille_Mapa,D_10_01_01_02_01_02_Annulation_Annulinfoannonceanterieur_Reference_Typeavis_Famille_Fns,D_10_01_01_02_01_03_Annulation_Annulinfoannonceanterieur_Reference_Typeavis_Famille_Joue,D_10_01_01_02_01_04_Annulation_Annulinfoannonceanterieur_Reference_Typeavis_Famille_Dsp,D_10_01_01_02_01_05_Annulation_Annulinfoannonceanterieur_Reference_Typeavis_Famille_Divers,D_10_01_01_02_02_Annulation_Annulinfoannonceanterieur_Reference_Typeavis_Perimetre,D_10_01_01_02_02_01_Annulation_Annulinfoannonceanterieur_Reference_Typeavis_Perimetre_Cmp2006,D_10_01_01_02_02_02_Annulation_Annulinfoannonceanterieur_Reference_Typeavis_Perimetre_Cmp2006DEFENSE,D_10_01_01_02_02_03_Annulation_Annulinfoannonceanterieur_Reference_Typeavis_Perimetre_Directive18,D_10_01_01_02_02_04_Annulation_Annulinfoannonceanterieur_Reference_Typeavis_Perimetre_Directive17,D_10_01_01_02_02_05_Annulation_Annulinfoannonceanterieur_Reference_Typeavis_Perimetre_Directive81,D_10_01_01_02_02_06_Annulation_Annulinfoannonceanterieur_Reference_Typeavis_Perimetre_Directive23,D_10_01_01_02_02_07_Annulation_Annulinfoannonceanterieur_Reference_Typeavis_Perimetre_Directive24,D_10_01_01_02_02_08_Annulation_Annulinfoannonceanterieur_Reference_Typeavis_Perimetre_Directive25,D_10_01_01_02_02_09_Annulation_Annulinfoannonceanterieur_Reference_Typeavis_Perimetre_Dsp,D_10_01_01_02_02_10_Annulation_Annulinfoannonceanterieur_Reference_Typeavis_Perimetre_Autre,D_10_01_01_02_03_Annulation_Annulinfoannonceanterieur_Reference_Typeavis_Nature,D_10_01_01_02_03_01_Annulation_Annulinfoannonceanterieur_Reference_Typeavis_Nature_Preinformation,D_10_01_01_02_03_02_Annulation_Annulinfoannonceanterieur_Reference_Typeavis_Nature_Profilacheteur,D_10_01_01_02_03_03_Annulation_Annulinfoannonceanterieur_Reference_Typeavis_Nature_Appeloffre,D_10_01_01_02_03_03_01_Annulation_Annulinfoannonceanterieur_Reference_Typeavis_Nature_Appeloffre_Standard,D_10_01_01_02_03_03_02_Annulation_Annulinfoannonceanterieur_Reference_Typeavis_Nature_Appeloffre_Concours,D_10_01_01_02_03_03_03_Annulation_Annulinfoannonceanterieur_Reference_Typeavis_Nature_Appeloffre_Periodique,D_10_01_01_02_03_03_04_Annulation_Annulinfoannonceanterieur_Reference_Typeavis_Nature_Appeloffre_Qualification,D_10_01_01_02_03_03_05_Annulation_Annulinfoannonceanterieur_Reference_Typeavis_Nature_Appeloffre_Sad,D_10_01_01_02_03_03_06_Annulation_Annulinfoannonceanterieur_Reference_Typeavis_Nature_Appeloffre_Concession,D_10_01_01_02_03_03_07_Annulation_Annulinfoannonceanterieur_Reference_Typeavis_Nature_Appeloffre_Concessionnaire,D_10_01_01_02_03_04_Annulation_Annulinfoannonceanterieur_Reference_Typeavis_Nature_Intentionconclure,D_10_01_01_02_03_05_Annulation_Annulinfoannonceanterieur_Reference_Typeavis_Nature_Attribution,D_10_01_01_02_03_05_01_Annulation_Annulinfoannonceanterieur_Reference_Typeavis_Nature_Attribution_Standard,D_10_01_01_02_03_05_02_Annulation_Annulinfoannonceanterieur_Reference_Typeavis_Nature_Attribution_Concours,D_10_01_01_02_03_05_03_Annulation_Annulinfoannonceanterieur_Reference_Typeavis_Nature_Attribution_Concession,D_10_01_01_02_03_05_04_Annulation_Annulinfoannonceanterieur_Reference_Typeavis_Nature_Attribution_Standardinfructueuxsanssuite,D_10_01_01_02_03_06_Annulation_Annulinfoannonceanterieur_Reference_Typeavis_Nature_Soustraitance,D_10_01_01_02_03_07_Annulation_Annulinfoannonceanterieur_Reference_Typeavis_Nature_Modification,D_10_01_01_02_03_08_Annulation_Annulinfoannonceanterieur_Reference_Typeavis_Nature_Qualification,D_10_01_01_02_03_09_Annulation_Annulinfoannonceanterieur_Reference_Typeavis_Nature_Rectificatif,D_10_01_01_02_03_10_Annulation_Annulinfoannonceanterieur_Reference_Typeavis_Nature_Periodique,D_10_01_01_02_03_11_Annulation_Annulinfoannonceanterieur_Reference_Typeavis_Nature_Autre,D_10_01_01_02_04_Annulation_Annulinfoannonceanterieur_Reference_Typeavis_Statut,D_10_01_01_02_04_01_Annulation_Annulinfoannonceanterieur_Reference_Typeavis_Statut_Initial,D_10_01_01_02_04_02_Annulation_Annulinfoannonceanterieur_Reference_Typeavis_Statut_Rectificatif,D_10_01_01_02_04_03_Annulation_Annulinfoannonceanterieur_Reference_Typeavis_Statut_Annulation,D_10_01_01_02_04_04_Annulation_Annulinfoannonceanterieur_Reference_Typeavis_Statut_Modification,D_10_01_01_03_Annulation_Annulinfoannonceanterieur_Reference_Dateenvoi,D_10_01_02_Annulation_Annulinfoannonceanterieur_Referencepublication,D_10_01_02_01_Annulation_Annulinfoannonceanterieur_Referencepublication_Publicationpapier,D_10_01_02_02_Annulation_Annulinfoannonceanterieur_Referencepublication_Publicationelectronique,D_10_01_02_02_01_Annulation_Annulinfoannonceanterieur_Referencepublication_Publicationelectronique_Datepublication,D_10_01_02_02_02_Annulation_Annulinfoannonceanterieur_Referencepublication_Publicationelectronique_Datefindiffusion,D_10_01_02_03_Annulation_Annulinfoannonceanterieur_Referencepublication_Publicationjoue,D_10_01_02_03_01_Annulation_Annulinfoannonceanterieur_Referencepublication_Publicationjoue_Annee,D_10_01_02_03_02_Annulation_Annulinfoannonceanterieur_Referencepublication_Publicationjoue_Numparution,D_10_01_02_03_03_Annulation_Annulinfoannonceanterieur_Referencepublication_Publicationjoue_Numannonce,D_10_01_02_03_04_Annulation_Annulinfoannonceanterieur_Referencepublication_Publicationjoue_Datepublication,D_10_02_Annulation_Motif
18-10501,CF_NIV_SUIV,CF_NIV_SUIV,17-182848,CF_NIV_SUIV,CF_NIV_SUIV,False,True,False,,,CF_NIV_SUIV,True,,,,False,,,,,,CF_NIV_SUIV,,,CF_NIV_SUIV,,,,,,,,,CF_NIV_SUIV,,,,,,,,,,,CF_NIV_SUIV,True,,,,,CF_NIV_SUIV,[],CF_NIV_SUIV,2017-12-27 23:00:00,2018-01-14 23:00:00,CF_NIV_SUIV,,,,,"La procédure est déclarée "" sans suite "" en raison d'un changement dans la définition du besoin conformément à l'article 98 du décret no 2016-360 du 25 mars 2016 relatif aux marchés publics. Une nouvelle procédure sera relancée"
18-10526,CF_NIV_SUIV,CF_NIV_SUIV,18-5864,CF_NIV_SUIV,CF_NIV_SUIV,False,True,False,,,CF_NIV_SUIV,True,,,,False,,,,,,CF_NIV_SUIV,,,CF_NIV_SUIV,,,,,,,,,CF_NIV_SUIV,,,,,,,,,,,CF_NIV_SUIV,True,,,,,CF_NIV_SUIV,[],CF_NIV_SUIV,2018-01-14 23:00:00,2018-02-15 23:00:00,CF_NIV_SUIV,,,,,"Support de publicité mis en oeuvre pour cette consultation : de niveau national, non adapté au regard de la valeur estimée du besoin, supérieure au seuil européen"
18-10534,CF_NIV_SUIV,CF_NIV_SUIV,18-175,CF_NIV_SUIV,CF_NIV_SUIV,False,True,False,,,CF_NIV_SUIV,True,,,,False,,,,,,CF_NIV_SUIV,,,CF_NIV_SUIV,,,,,,,,,CF_NIV_SUIV,,,,,,,,,,,CF_NIV_SUIV,True,,,,,CF_NIV_SUIV,[],CF_NIV_SUIV,2018-01-01 23:00:00,2018-01-30 23:00:00,CF_NIV_SUIV,,,,,modification de la définition des besoins
18-10593,CF_NIV_SUIV,CF_NIV_SUIV,18-10031,CF_NIV_SUIV,CF_NIV_SUIV,False,True,False,,,CF_NIV_SUIV,True,,,,False,,,,,,CF_NIV_SUIV,,,CF_NIV_SUIV,,,,,,,,,CF_NIV_SUIV,,,,,,,,,,,CF_NIV_SUIV,True,,,,,CF_NIV_SUIV,[],CF_NIV_SUIV,2018-01-22 23:00:00,2018-04-29 22:00:00,CF_NIV_SUIV,,,,,"Cette avis d'attribution ne concerne pas l'avis initial no17-171430 mais celui portant le no17-134976 relatif à l'infogérance des serveurs, des réseaux et de la sécurité informatique du SDEC ENERGIE."
18-12130,CF_NIV_SUIV,CF_NIV_SUIV,18-8503,CF_NIV_SUIV,CF_NIV_SUIV,False,True,False,,,CF_NIV_SUIV,True,,,,False,,,,,,CF_NIV_SUIV,,,CF_NIV_SUIV,,,,,,,,,CF_NIV_SUIV,,,,,,,,,,,CF_NIV_SUIV,True,,,,,CF_NIV_SUIV,[],CF_NIV_SUIV,2018-01-18 23:00:00,2018-02-25 23:00:00,CF_NIV_SUIV,,,,,Mauvaise définition de procédure de passation
18-1240,CF_NIV_SUIV,CF_NIV_SUIV,18-708,CF_NIV_SUIV,CF_NIV_SUIV,False,True,False,,,CF_NIV_SUIV,True,,,,False,,,,,,CF_NIV_SUIV,,,CF_NIV_SUIV,,,,,,,,,CF_NIV_SUIV,,,,,,,,,,,CF_NIV_SUIV,True,,,,,CF_NIV_SUIV,[],CF_NIV_SUIV,2018-01-02 23:00:00,2018-02-05 23:00:00,CF_NIV_SUIV,,,,,"doublon avec avis no 18-1063 car je n'avais publié qu'au BOAMP et pas au JOUE, et du coup j'ai refait un avis (no 18-1063)"
18-12688,CF_NIV_SUIV,CF_NIV_SUIV,18-10115,CF_NIV_SUIV,CF_NIV_SUIV,False,True,False,,,CF_NIV_SUIV,True,,,,False,,,,,,CF_NIV_SUIV,,,CF_NIV_SUIV,,,,,,,,,CF_NIV_SUIV,,,,,,,,,,,CF_NIV_SUIV,True,,,,,CF_NIV_SUIV,[],CF_NIV_SUIV,2018-01-22 23:00:00,2018-02-08 23:00:00,CF_NIV_SUIV,,,,,"La présente consultation, au titre de laquelle vous avez retiré un dossier, est annulée au motif de la redéfinition du besoin.Cette consultation sera relancée ultérieurement"
18-12717,CF_NIV_SUIV,CF_NIV_SUIV,18-12083,CF_NIV_SUIV,CF_NIV_SUIV,True,False,False,,,CF_NIV_SUIV,True,,,,False,,,,,,CF_NIV_SUIV,,,CF_NIV_SUIV,,,,,,,,,CF_NIV_SUIV,,,,,,,,,,,CF_NIV_SUIV,True,,,,,CF_NIV_SUIV,[],CF_NIV_SUIV,2018-01-25 23:00:00,2018-02-15 23:00:00,CF_NIV_SUIV,,,,,Erreur sur la catégorie de marché
18-12768,CF_NIV_SUIV,CF_NIV_SUIV,18-12285,CF_NIV_SUIV,CF_NIV_SUIV,False,True,False,,,CF_NIV_SUIV,True,,,,False,,,,,,CF_NIV_SUIV,,,CF_NIV_SUIV,,,,,,,,,CF_NIV_SUIV,,,,,,,,,,,CF_NIV_SUIV,True,,,,,CF_NIV_SUIV,[],CF_NIV_SUIV,2018-01-25 23:00:00,2018-02-20 23:00:00,CF_NIV_SUIV,,,,,mauvais organisme
18-12781,CF_NIV_SUIV,CF_NIV_SUIV,18-12549,CF_NIV_SUIV,CF_NIV_SUIV,False,True,False,,,CF_NIV_SUIV,True,,,,False,,,,,,CF_NIV_SUIV,,,CF_NIV_SUIV,,,,,,,,,CF_NIV_SUIV,,,,,,,,,,,CF_NIV_SUIV,True,,,,,CF_NIV_SUIV,[],CF_NIV_SUIV,2018-01-25 23:00:00,2018-02-25 23:00:00,CF_NIV_SUIV,,,,,Le présent avis est remplacé par l'avis : Avis publié AU BOAMP xml N° 18-12625
18-12891,CF_NIV_SUIV,CF_NIV_SUIV,18-12063,CF_NIV_SUIV,CF_NIV_SUIV,True,False,False,,,CF_NIV_SUIV,True,,,,False,,,,,,CF_NIV_SUIV,,,CF_NIV_SUIV,,,,,,,,,CF_NIV_SUIV,,,,,,,,,,,CF_NIV_SUIV,True,,,,,CF_NIV_SUIV,[],CF_NIV_SUIV,2018-01-25 23:00:00,2018-02-14 23:00:00,CF_NIV_SUIV,,,,,Redéfinition précise des besoins
18-13527,CF_NIV_SUIV,CF_NIV_SUIV,18-5339,CF_NIV_SUIV,CF_NIV_SUIV,False,True,False,,,CF_NIV_SUIV,True,,,,False,,,,,,CF_NIV_SUIV,,,CF_NIV_SUIV,,,,,,,,,CF_NIV_SUIV,,,,,,,,,,,CF_NIV_SUIV,True,,,,,CF_NIV_SUIV,[],CF_NIV_SUIV,2018-01-11 23:00:00,2018-02-05 23:00:00,CF_NIV_SUIV,,,,,Le pouvoir adjudicateur a décidé de déclarer sans suite la procédure de marché aux motifs que le permis de construire n'est pas conforme aux travaux décrits dans le DCE
18-13601,CF_NIV_SUIV,CF_NIV_SUIV,18-3920,CF_NIV_SUIV,CF_NIV_SUIV,True,False,False,,,CF_NIV_SUIV,True,,,,False,,,,,,CF_NIV_SUIV,,,CF_NIV_SUIV,,,,,,,,,CF_NIV_SUIV,,,,,,,,,,,CF_NIV_SUIV,True,,,,,CF_NIV_SUIV,[],CF_NIV_SUIV,2018-01-21 23:00:00,2018-02-18 23:00:00,CF_NIV_SUIV,,,,,Mauvaise définition du besoin
18-14021,CF_NIV_SUIV,CF_NIV_SUIV,18-7591,CF_NIV_SUIV,CF_NIV_SUIV,False,True,False,,,CF_NIV_SUIV,True,,,,False,,,,,,CF_NIV_SUIV,,,CF_NIV_SUIV,,,,,,,,,CF_NIV_SUIV,,,,,,,,,,,CF_NIV_SUIV,True,,,,,CF_NIV_SUIV,[],CF_NIV_SUIV,2018-01-16 23:00:00,2018-02-05 23:00:00,CF_NIV_SUIV,,,,,Procédure déclarée sans suite pour motif d'intérêt général lié à une redéfinition du besoin.
