BOAMP_AVIS_NUM,D_10_01_Annulation_Annulinfoannonceanterieur,D_10_01_01_Annulation_Annulinfoannonceanterieur_Reference,D_10_01_01_01_Annulation_Annulinfoannonceanterieur_Reference_Idweb,D_10_01_01_02_Annulation_Annulinfoannonceanterieur_Reference_Typeavis,D_10_01_01_02_01_Annulation_Annulinfoannonceanterieur_Reference_Typeavis_Famille,D_10_01_01_02_01_01_Annulation_Annulinfoannonceanterieur_Reference_Typeavis_Famille_Mapa,D_10_01_01_02_01_02_Annulation_Annulinfoannonceanterieur_Reference_Typeavis_Famille_Fns,D_10_01_01_02_01_03_Annulation_Annulinfoannonceanterieur_Reference_Typeavis_Famille_Joue,D_10_01_01_02_01_04_Annulation_Annulinfoannonceanterieur_Reference_Typeavis_Famille_Dsp,D_10_01_01_02_01_05_Annulation_Annulinfoannonceanterieur_Reference_Typeavis_Famille_Divers,D_10_01_01_02_02_Annulation_Annulinfoannonceanterieur_Reference_Typeavis_Perimetre,D_10_01_01_02_02_01_Annulation_Annulinfoannonceanterieur_Reference_Typeavis_Perimetre_Cmp2006,D_10_01_01_02_02_02_Annulation_Annulinfoannonceanterieur_Reference_Typeavis_Perimetre_Cmp2006DEFENSE,D_10_01_01_02_02_03_Annulation_Annulinfoannonceanterieur_Reference_Typeavis_Perimetre_Directive18,D_10_01_01_02_02_04_Annulation_Annulinfoannonceanterieur_Reference_Typeavis_Perimetre_Directive17,D_10_01_01_02_02_05_Annulation_Annulinfoannonceanterieur_Reference_Typeavis_Perimetre_Directive81,D_10_01_01_02_02_06_Annulation_Annulinfoannonceanterieur_Reference_Typeavis_Perimetre_Directive23,D_10_01_01_02_02_07_Annulation_Annulinfoannonceanterieur_Reference_Typeavis_Perimetre_Directive24,D_10_01_01_02_02_08_Annulation_Annulinfoannonceanterieur_Reference_Typeavis_Perimetre_Directive25,D_10_01_01_02_02_09_Annulation_Annulinfoannonceanterieur_Reference_Typeavis_Perimetre_Dsp,D_10_01_01_02_02_10_Annulation_Annulinfoannonceanterieur_Reference_Typeavis_Perimetre_Autre,D_10_01_01_02_03_Annulation_Annulinfoannonceanterieur_Reference_Typeavis_Nature,D_10_01_01_02_03_01_Annulation_Annulinfoannonceanterieur_Reference_Typeavis_Nature_Preinformation,D_10_01_01_02_03_02_Annulation_Annulinfoannonceanterieur_Reference_Typeavis_Nature_Profilacheteur,D_10_01_01_02_03_03_Annulation_Annulinfoannonceanterieur_Reference_Typeavis_Nature_Appeloffre,D_10_01_01_02_03_03_01_Annulation_Annulinfoannonceanterieur_Reference_Typeavis_Nature_Appeloffre_Standard,D_10_01_01_02_03_03_02_Annulation_Annulinfoannonceanterieur_Reference_Typeavis_Nature_Appeloffre_Concours,D_10_01_01_02_03_03_03_Annulation_Annulinfoannonceanterieur_Reference_Typeavis_Nature_Appeloffre_Periodique,D_10_01_01_02_03_03_04_Annulation_Annulinfoannonceanterieur_Reference_Typeavis_Nature_Appeloffre_Qualification,D_10_01_01_02_03_03_05_Annulation_Annulinfoannonceanterieur_Reference_Typeavis_Nature_Appeloffre_Sad,D_10_01_01_02_03_03_06_Annulation_Annulinfoannonceanterieur_Reference_Typeavis_Nature_Appeloffre_Concession,D_10_01_01_02_03_03_07_Annulation_Annulinfoannonceanterieur_Reference_Typeavis_Nature_Appeloffre_Concessionnaire,D_10_01_01_02_03_04_Annulation_Annulinfoannonceanterieur_Reference_Typeavis_Nature_Intentionconclure,D_10_01_01_02_03_05_Annulation_Annulinfoannonceanterieur_Reference_Typeavis_Nature_Attribution,D_10_01_01_02_03_05_01_Annulation_Annulinfoannonceanterieur_Reference_Typeavis_Nature_Attribution_Standard,D_10_01_01_02_03_05_02_Annulation_Annulinfoannonceanterieur_Reference_Typeavis_Nature_Attribution_Concours,D_10_01_01_02_03_05_03_Annulation_Annulinfoannonceanterieur_Reference_Typeavis_Nature_Attribution_Concession,D_10_01_01_02_03_05_04_Annulation_Annulinfoannonceanterieur_Reference_Typeavis_Nature_Attribution_Standardinfructueuxsanssuite,D_10_01_01_02_03_06_Annulation_Annulinfoannonceanterieur_Reference_Typeavis_Nature_Soustraitance,D_10_01_01_02_03_07_Annulation_Annulinfoannonceanterieur_Reference_Typeavis_Nature_Modification,D_10_01_01_02_03_08_Annulation_Annulinfoannonceanterieur_Reference_Typeavis_Nature_Qualification,D_10_01_01_02_03_09_Annulation_Annulinfoannonceanterieur_Reference_Typeavis_Nature_Rectificatif,D_10_01_01_02_03_10_Annulation_Annulinfoannonceanterieur_Reference_Typeavis_Nature_Periodique,D_10_01_01_02_03_11_Annulation_Annulinfoannonceanterieur_Reference_Typeavis_Nature_Autre,D_10_01_01_02_04_Annulation_Annulinfoannonceanterieur_Reference_Typeavis_Statut,D_10_01_01_02_04_01_Annulation_Annulinfoannonceanterieur_Reference_Typeavis_Statut_Initial,D_10_01_01_02_04_02_Annulation_Annulinfoannonceanterieur_Reference_Typeavis_Statut_Rectificatif,D_10_01_01_02_04_03_Annulation_Annulinfoannonceanterieur_Reference_Typeavis_Statut_Annulation,D_10_01_01_02_04_04_Annulation_Annulinfoannonceanterieur_Reference_Typeavis_Statut_Modification,D_10_01_01_03_Annulation_Annulinfoannonceanterieur_Reference_Dateenvoi,D_10_01_02_Annulation_Annulinfoannonceanterieur_Referencepublication,D_10_01_02_01_Annulation_Annulinfoannonceanterieur_Referencepublication_Publicationpapier,D_10_01_02_02_Annulation_Annulinfoannonceanterieur_Referencepublication_Publicationelectronique,D_10_01_02_02_01_Annulation_Annulinfoannonceanterieur_Referencepublication_Publicationelectronique_Datepublication,D_10_01_02_02_02_Annulation_Annulinfoannonceanterieur_Referencepublication_Publicationelectronique_Datefindiffusion,D_10_01_02_03_Annulation_Annulinfoannonceanterieur_Referencepublication_Publicationjoue,D_10_01_02_03_01_Annulation_Annulinfoannonceanterieur_Referencepublication_Publicationjoue_Annee,D_10_01_02_03_02_Annulation_Annulinfoannonceanterieur_Referencepublication_Publicationjoue_Numparution,D_10_01_02_03_03_Annulation_Annulinfoannonceanterieur_Referencepublication_Publicationjoue_Numannonce,D_10_01_02_03_04_Annulation_Annulinfoannonceanterieur_Referencepublication_Publicationjoue_Datepublication,D_10_02_Annulation_Motif
18-28953,CF_NIV_SUIV,CF_NIV_SUIV,18-22886,CF_NIV_SUIV,CF_NIV_SUIV,False,True,False,,,CF_NIV_SUIV,True,,,,False,,,,,,CF_NIV_SUIV,,,CF_NIV_SUIV,,,,,,,,,CF_NIV_SUIV,,,,,,,,,,,CF_NIV_SUIV,True,,,,,CF_NIV_SUIV,[],CF_NIV_SUIV,2018-02-15 23:00:00,2018-03-11 23:00:00,CF_NIV_SUIV,,,,,"La procédure est déclarée sans suite, pour un motif lié à la sécurité juridique de la procédure."
18-30135,CF_NIV_SUIV,CF_NIV_SUIV,18-20513,CF_NIV_SUIV,CF_NIV_SUIV,False,True,False,,,CF_NIV_SUIV,True,,,,False,,,,,,CF_NIV_SUIV,,,CF_NIV_SUIV,,,,,,,,,CF_NIV_SUIV,,,,,,,,,,,CF_NIV_SUIV,True,,,,,CF_NIV_SUIV,[],CF_NIV_SUIV,2018-02-11 23:00:00,2018-04-11 22:00:00,CF_NIV_SUIV,,,,,Les marchés mentionnés au I de l'avis relatif aux contrats de la commande publique ayant pour objet des services sociaux et autres services spécifiques doivent faire l'objet d'une publicité européenne s'ils dépassent le seuil de 750 000 euro(s)HT conformément à l'article 35 du décret no2016-360 du 25 mars 2016 relatif aux marchés publics ;
18-30184,CF_NIV_SUIV,CF_NIV_SUIV,18-29813,CF_NIV_SUIV,CF_NIV_SUIV,False,True,False,,,CF_NIV_SUIV,True,,,,False,,,,,,CF_NIV_SUIV,,,CF_NIV_SUIV,,,,,,,,,CF_NIV_SUIV,,,,,,,,,,,CF_NIV_SUIV,True,,,,,CF_NIV_SUIV,[],CF_NIV_SUIV,2018-03-01 23:00:00,2018-03-25 22:00:00,CF_NIV_SUIV,,,,,Suite à plusieurs erreurs dans la publicité
18-30566,CF_NIV_SUIV,CF_NIV_SUIV,18-29947,CF_NIV_SUIV,CF_NIV_SUIV,False,True,False,,,CF_NIV_SUIV,True,,,,False,,,,,,CF_NIV_SUIV,,,CF_NIV_SUIV,,,,,,,,,CF_NIV_SUIV,,,,,,,,,,,CF_NIV_SUIV,True,,,,,CF_NIV_SUIV,[],CF_NIV_SUIV,2018-03-01 23:00:00,2018-03-29 22:00:00,CF_NIV_SUIV,,,,,Annonce incomplètee
18-31410,CF_NIV_SUIV,CF_NIV_SUIV,18-19235,CF_NIV_SUIV,CF_NIV_SUIV,True,False,False,,,CF_NIV_SUIV,True,,,,False,,,,,,CF_NIV_SUIV,,,CF_NIV_SUIV,,,,,,,,,CF_NIV_SUIV,,,,,,,,,,,CF_NIV_SUIV,True,,,,,CF_NIV_SUIV,[],CF_NIV_SUIV,2018-02-26 23:00:00,2018-03-20 23:00:00,CF_NIV_SUIV,,,,,Erreur de formulaire de publicité.Nouvelle publicité en cours de parution
18-31475,CF_NIV_SUIV,CF_NIV_SUIV,18-21672,CF_NIV_SUIV,CF_NIV_SUIV,True,False,False,,,CF_NIV_SUIV,True,,,,False,,,,,,CF_NIV_SUIV,,,CF_NIV_SUIV,,,,,,,,,CF_NIV_SUIV,,,,,,,,,,,CF_NIV_SUIV,True,,,,,CF_NIV_SUIV,[],CF_NIV_SUIV,2018-02-13 23:00:00,2018-03-11 23:00:00,CF_NIV_SUIV,,,,,La présente consultation est déclarée sans suite aux motifs que des erreurs sont présentes dans les exigences techniques des prestations.
18-31587,CF_NIV_SUIV,CF_NIV_SUIV,18-11137,CF_NIV_SUIV,CF_NIV_SUIV,False,True,False,,,CF_NIV_SUIV,True,,,,False,,,,,,CF_NIV_SUIV,,,CF_NIV_SUIV,,,,,,,,,CF_NIV_SUIV,,,,,,,,,,,CF_NIV_SUIV,True,,,,,CF_NIV_SUIV,[],CF_NIV_SUIV,2018-02-01 23:00:00,2018-03-08 23:00:00,CF_NIV_SUIV,,,,,Nécessité de revoir le cahier des charges du présent marché pour intégrer des précisions sur les caractéristiques techniques des matériels souhaités.Un nouveau marché sera publié en avril 2018 pour la location et la maintenance de 18 matériels photocopieurs.
18-31596,CF_NIV_SUIV,CF_NIV_SUIV,18-29283,CF_NIV_SUIV,CF_NIV_SUIV,False,True,False,,,CF_NIV_SUIV,True,,,,False,,,,,,CF_NIV_SUIV,,,CF_NIV_SUIV,,,,,,,,,CF_NIV_SUIV,,,,,,,,,,,CF_NIV_SUIV,True,,,,,CF_NIV_SUIV,[],CF_NIV_SUIV,2018-02-28 23:00:00,2018-04-19 22:00:00,CF_NIV_SUIV,,,,,Non respect de l'article 32 de l'Ordonnance no 2015-899 du 23 juillet 2015 relative aux marchés publics
18-32715,CF_NIV_SUIV,CF_NIV_SUIV,18-22757,CF_NIV_SUIV,CF_NIV_SUIV,False,True,False,,,CF_NIV_SUIV,True,,,,False,,,,,,CF_NIV_SUIV,,,CF_NIV_SUIV,,,,,,,,,CF_NIV_SUIV,,,,,,,,,,,CF_NIV_SUIV,True,,,,,CF_NIV_SUIV,[],CF_NIV_SUIV,2018-02-15 23:00:00,2018-03-13 23:00:00,CF_NIV_SUIV,,,,,"La présente consultation est annulée suite de la décision du pouvoir adjudicateur de renoncer à passer le marché pour des motifs d'intérêt général.Dans le cas de l'espèce, le motif est d'ordre juridique et technique, cette déclaration sans suite étant motivée par le fait de mettre fin à une procédure entachée d'irrégularité.Il existe une contradiction entre les pièces du marché, notamment entre l'article 1.2 du règlement de consultation précisant le seuil maximum annuel de l'accord cadre et l'article 3.1 du CCP qui dispose que 'la valeur faciale des titres restaurant est fixée à 6 euros. Pour information, à titre indicatif et non contractuel , le nombre annuel de titres restaurant est estimé à 11 280(...)'.Or, 11 280 titres restaurantx6euro= 67 680 euro annuel.En outre, l'article 3.1 du CCP dispose 'qu'en cas de vol, destruction pendant le transport ainsi qu'en cas de dysfonctionnement de cartes, le titulaire devra remplacer celles-ci à ses frais sous 48 heures'. Il s'agit d'une erreur dans nos exigences techniques."
18-33834,CF_NIV_SUIV,CF_NIV_SUIV,18-33475,CF_NIV_SUIV,CF_NIV_SUIV,False,True,False,,,CF_NIV_SUIV,True,,,,False,,,,,,CF_NIV_SUIV,,,CF_NIV_SUIV,,,,,,,,,CF_NIV_SUIV,,,,,,,,,,,CF_NIV_SUIV,True,,,,,CF_NIV_SUIV,[],CF_NIV_SUIV,2018-03-08 23:00:00,2018-04-12 22:00:00,CF_NIV_SUIV,,,,,Une nouvelle annonce annule et remplace celle-ci.Référence nouvelle annonce : 18-33835
18-33901,CF_NIV_SUIV,CF_NIV_SUIV,18-27811,CF_NIV_SUIV,CF_NIV_SUIV,False,True,False,,,CF_NIV_SUIV,True,,,,False,,,,,,CF_NIV_SUIV,,,CF_NIV_SUIV,,,,,,,,,CF_NIV_SUIV,,,,,,,,,,,CF_NIV_SUIV,True,,,,,CF_NIV_SUIV,[],CF_NIV_SUIV,2018-02-27 23:00:00,2018-03-22 23:00:00,CF_NIV_SUIV,,,,,Cette publication est annulée pour des motifs d'intérêt général.
18-34105,CF_NIV_SUIV,CF_NIV_SUIV,18-31816,CF_NIV_SUIV,CF_NIV_SUIV,True,False,False,,,CF_NIV_SUIV,True,,,,False,,,,,,CF_NIV_SUIV,,,CF_NIV_SUIV,,,,,,,,,CF_NIV_SUIV,,,,,,,,,,,CF_NIV_SUIV,True,,,,,CF_NIV_SUIV,[],CF_NIV_SUIV,2018-03-05 23:00:00,2018-03-29 22:00:00,CF_NIV_SUIV,,,,,"Suite à un élément manquant dans le dossier de consultation, cette dernière est annulée. Un nouvel avis sera publié"
18-34228,CF_NIV_SUIV,CF_NIV_SUIV,18-27967,CF_NIV_SUIV,CF_NIV_SUIV,False,True,False,,,CF_NIV_SUIV,True,,,,False,,,,,,CF_NIV_SUIV,,,CF_NIV_SUIV,,,,,,,,,CF_NIV_SUIV,,,,,,,,,,,CF_NIV_SUIV,True,,,,,CF_NIV_SUIV,[],CF_NIV_SUIV,2018-02-26 23:00:00,2018-04-04 22:00:00,CF_NIV_SUIV,,,,,Erreur de pièces au DCE - La consultation sera relancée dans les semaines à venir.
18-34496,CF_NIV_SUIV,CF_NIV_SUIV,18-33401,CF_NIV_SUIV,CF_NIV_SUIV,False,True,False,,,CF_NIV_SUIV,True,,,,False,,,,,,CF_NIV_SUIV,,,CF_NIV_SUIV,,,,,,,,,CF_NIV_SUIV,,,,,,,,,,,CF_NIV_SUIV,True,,,,,CF_NIV_SUIV,[],CF_NIV_SUIV,2018-03-08 23:00:00,2018-04-02 22:00:00,CF_NIV_SUIV,,,,,Les marchés de travaux rencontrent des modifications substantielles dans leur réalisation et leur exécution.Une nouvelle consultation sera menée à modification des pièces techniques
18-34735,CF_NIV_SUIV,CF_NIV_SUIV,18-28166,CF_NIV_SUIV,CF_NIV_SUIV,True,False,False,,,CF_NIV_SUIV,True,,,,False,,,,,,CF_NIV_SUIV,,,CF_NIV_SUIV,,,,,,,,,CF_NIV_SUIV,,,,,,,,,,,CF_NIV_SUIV,True,,,,,CF_NIV_SUIV,[],CF_NIV_SUIV,2018-02-26 23:00:00,2018-03-26 22:00:00,CF_NIV_SUIV,,,,,Erreur concernant le pouvoir adjudicateur.
18-35089,CF_NIV_SUIV,CF_NIV_SUIV,18-26286,CF_NIV_SUIV,CF_NIV_SUIV,False,True,False,,,CF_NIV_SUIV,True,,,,False,,,,,,CF_NIV_SUIV,,,CF_NIV_SUIV,,,,,,,,,CF_NIV_SUIV,,,,,,,,,,,CF_NIV_SUIV,True,,,,,CF_NIV_SUIV,[],CF_NIV_SUIV,2018-02-22 23:00:00,2018-03-29 22:00:00,CF_NIV_SUIV,,,,,Problème de publicité sur l'avis 3231103 non publié au JOUE
18-35288,CF_NIV_SUIV,CF_NIV_SUIV,18-34223,CF_NIV_SUIV,CF_NIV_SUIV,False,True,False,,,CF_NIV_SUIV,True,,,,False,,,,,,CF_NIV_SUIV,,,CF_NIV_SUIV,,,,,,,,,CF_NIV_SUIV,,,,,,,,,,,CF_NIV_SUIV,True,,,,,CF_NIV_SUIV,[],CF_NIV_SUIV,2018-03-11 23:00:00,2018-04-12 22:00:00,CF_NIV_SUIV,,,,,"En raison d'un problème technique, la consultation fait l'objet d'un nouvel avis au BOAMP, sous la référence 18-35286.Les documents de la consultation sont téléchargeables à l'adresse suivante: https://www.marches-publics.gouv.fr/?page=entreprise.EntrepriseAdvancedSearch&AllCons&refConsultation=369525&orgAcronyme=g6l"
18-35409,CF_NIV_SUIV,CF_NIV_SUIV,18-26662,CF_NIV_SUIV,CF_NIV_SUIV,False,True,False,,,CF_NIV_SUIV,True,,,,False,,,,,,CF_NIV_SUIV,,,CF_NIV_SUIV,,,,,,,,,CF_NIV_SUIV,,,,,,,,,,,CF_NIV_SUIV,True,,,,,CF_NIV_SUIV,[],CF_NIV_SUIV,2018-02-22 23:00:00,2018-03-15 23:00:00,CF_NIV_SUIV,,,,,"Bonjour,Nous vous informons que dans un souci de sécurisation juridique de la procédure, il a été décidé de déclarer celle-ci sans suite.Cordialement,Le service des Marchés publics"
18-35712,CF_NIV_SUIV,CF_NIV_SUIV,18-595,CF_NIV_SUIV,CF_NIV_SUIV,True,False,False,,,CF_NIV_SUIV,True,,,,False,,,,,,CF_NIV_SUIV,,,CF_NIV_SUIV,,,,,,,,,CF_NIV_SUIV,,,,,,,,,,,CF_NIV_SUIV,True,,,,,CF_NIV_SUIV,[],CF_NIV_SUIV,2018-01-02 23:00:00,2018-01-24 23:00:00,CF_NIV_SUIV,,,,,"- Considérant les disparités des offres financières reçues qui ne permettent pas d'assurer une bonne compréhension du besoin par l'ensemble des candidats,- Considérant que la nature du besoin a évolué entre la date de publication et la date d'analyse des offres reçues,Le Maître d'ouvrage a décidé:- De déclarer sans suite la présente consultation,- De relancer une nouvelle procédure."
18-36298,CF_NIV_SUIV,CF_NIV_SUIV,18-28285,CF_NIV_SUIV,CF_NIV_SUIV,False,True,False,,,CF_NIV_SUIV,True,,,,False,,,,,,CF_NIV_SUIV,,,CF_NIV_SUIV,,,,,,,,,CF_NIV_SUIV,,,,,,,,,,,CF_NIV_SUIV,True,,,,,CF_NIV_SUIV,[],CF_NIV_SUIV,2018-02-28 23:00:00,2018-03-21 23:00:00,CF_NIV_SUIV,,,,,Erreur dans le Dossier de Consultation
